{
  "$schema": "https://json-schema.org/draft/2020-12/schema",
  "$id": "https://raw-cli.dev/schemas/raw-package/v1",
  "type": "object",
  "additionalProperties": false,
  "required": ["schema_version", "name", "version", "description", "files", "exports"],
  "properties": {
    "schema_version": { "const": 1 },
    "name": { "type": "string", "pattern": "^@[a-z0-9][a-z0-9._-]*/[a-z0-9][a-z0-9._-]*$", "maxLength": 130 },
    "version": { "type": "string", "minLength": 1, "maxLength": 128 },
    "description": { "type": "string", "minLength": 1, "maxLength": 4096 },
    "license": { "type": "string", "maxLength": 256 },
    "repository": { "type": "string", "maxLength": 2048 },
    "keywords": { "type": "array", "uniqueItems": true, "maxItems": 32, "items": { "type": "string", "minLength": 1, "maxLength": 64 } },
    "files": { "type": "array", "minItems": 1, "maxItems": 4096, "uniqueItems": true,
      "items": { "type": "string", "minLength": 1, "maxLength": 512 } },
    "exports": { "type": "object", "minProperties": 1, "additionalProperties": false,
      "properties": {
        "agents": { "$ref": "#/$defs/exportMap" },
        "skills": { "$ref": "#/$defs/exportMap" },
        "tools": { "$ref": "#/$defs/exportMap" },
        "hooks": { "$ref": "#/$defs/exportMap" },
        "vars": { "$ref": "#/$defs/exportMap" },
        "var_providers": { "$ref": "#/$defs/exportMap" },
        "mcp": { "$ref": "#/$defs/exportMap" }
      }
    },
    "inputs": { "type": "object" },
    "requires": { "type": "array", "uniqueItems": true, "maxItems": 64, "items": { "type": "string", "minLength": 1, "maxLength": 128 } },
    "dependencies": { "type": "object", "propertyNames": { "pattern": "^[a-z][a-z0-9_-]*$" },
      "additionalProperties": { "type": "object", "additionalProperties": false,
        "required": ["name", "version", "digest", "archive"],
        "properties": {
          "name": { "type": "string" }, "version": { "type": "string" },
          "digest": { "type": "string", "pattern": "^[a-f0-9]{64}$" }, "archive": { "type": "string" }
        }
      }
    },
    "metadata": { "type": "object" }
  },
  "$defs": {
    "exportMap": { "type": "object", "minProperties": 1,
      "propertyNames": { "pattern": "^[a-z][a-z0-9_-]*$" },
      "additionalProperties": { "type": "string", "minLength": 1, "maxLength": 512 }
    }
  }
}
